UC1 :- Ability to create aAddress Book Service Database.
=========================================================================================================

mysql> create database AddressBook_Service;
Query OK, 1 row affected (0.01 sec)

mysql> show databases;
+---------------------+
| Database            |
+---------------------+
| addressbook_service |
| information_schema  |
| mysql               |
| payroll_service     |
| performance_schema  |
| sakila              |
| sys                 |
| world               |
+---------------------+
8 rows in set (0.01 sec)

------------------------------------------------------------------------------------------------------------

UC2 :- Ability to create a Address Book Table with first and last names, address, 
city,state, zip, phone number and email as its attributes.
===========================================================================================================

mysql> use addressbook_service;
Database changed
mysql> create table AddressBook(
    -> FirstName Varchar(20) not null,
    -> LastName Varchar(20) not null,
    -> Address Varchar(20) not null,
    ->  City Varchar(20) not null,
    -> Zip Varchar(20) not null,
    -> PhoneNo Varchar(20) not null,
    -> Email Varchar(20) not null);
Query OK, 0 rows affected (0.01 sec)

mysql> show tables;
+-------------------------------+
| Tables_in_addressbook_service |
+-------------------------------+
| addressbook                   |
+-------------------------------+
1 row in set (0.01 sec)

mysql> desc addressbook;
+-----------+-------------+------+-----+---------+-------+
| Field     | Type        | Null | Key | Default | Extra |
+-----------+-------------+------+-----+---------+-------+
| FirstName | varchar(20) | NO   |     | NULL    |       |
| LastName  | varchar(20) | NO   |     | NULL    |       |
| Address   | varchar(20) | NO   |     | NULL    |       |
| City      | varchar(20) | NO   |     | NULL    |       |
| Zip       | varchar(20) | NO   |     | NULL    |       |
| PhoneNo   | varchar(20) | NO   |     | NULL    |       |
| Email     | varchar(20) | NO   |     | NULL    |       |
+-----------+-------------+------+-----+---------+-------+
7 rows in set (0.01 sec)

---------------------------------------------------------------------------------------------------------

UC3 :- Ability to insert new Contacts to Address Book.
==========================================================================================================

mysql> insert into AddressBook( FirstName, LastName, Address,City,Zip,phoneNO, Email) values  ('Supriya','Bhurle','Samata Colony','Bramhapuri','441206','9443561786','supriya09@gmail.com');
Query OK, 1 row affected (0.00 sec)

mysql>  insert into AddressBook( FirstName, LastName, Address,City,Zip,phoneNO, Email) values  ('Shivani','Nandeshwar','Nandanwan','Nagpur','441207','9443545678','shvani08@gmail.com');
Query OK, 1 row affected (0.00 sec)

mysql>  insert into AddressBook( FirstName, LastName, Address,City,Zip,phoneNO, Email) values  ('Mansi','Mannurwar','Hingewadi','Pune','441208','7856413897','mansi04@gmail.com');
Query OK, 1 row affected (0.00 sec)

mysql> select star * from AddressBook;
ERROR 1064 (42000): You have an error in your SQL syntax; check the manual that corresponds to your MySQL server version for the right syntax to use near 'from AddressBook' at line 1
mysql> select * from AddressBook;
+-----------+------------+---------------+------------+--------+------------+---------------------+
| FirstName | LastName   | Address       | City       | Zip    | PhoneNo    | Email               |
+-----------+------------+---------------+------------+--------+------------+---------------------+
| Supriya   | Bhurle     | Samata Colony | Bramhapuri | 441206 | 9443561786 | supriya09@gmail.com |
| Shivani   | Nandeshwar | Nandanwan     | Nagpur     | 441207 | 9443545678 | shvani08@gmail.com  |
| Mansi     | Mannurwar  | Hingewadi     | Pune       | 441208 | 7856413897 | mansi04@gmail.com   |
+-----------+------------+---------------+------------+--------+------------+---------------------+
3 rows in set (0.00 sec)

----------------------------------------------------------------------------------------------------------

UC4 :- Ability to edit existing contact person using their name.
========================================================================================================
mysql> update addressbook set PhoneNo = '8669136896' where FirstName = 'Supriya';
Query OK, 1 row affected (0.00 sec)
Rows matched: 1  Changed: 1  Warnings: 0

mysql> update addressbook set Zip = '441212' where FirstName = 'shivani';
Query OK, 1 row affected (0.00 sec)
Rows matched: 1  Changed: 1  Warnings: 0

mysql> select * from addressbook;
+-----------+------------+---------------+------------+--------+------------+---------------------+
| FirstName | LastName   | Address       | City       | Zip    | PhoneNo    | Email               |
+-----------+------------+---------------+------------+--------+------------+---------------------+
| Supriya   | Bhurle     | Samata Colony | Bramhapuri | 441206 | 8669136896 | supriya09@gmail.com |
| Shivani   | Nandeshwar | Nandanwan     | Nagpur     | 441212 | 9443545678 | shvani08@gmail.com  |
| Mansi     | Mannurwar  | Hingewadi     | Pune       | 441208 | 7856413897 | mansi04@gmail.com   |
+-----------+------------+---------------+------------+--------+------------+---------------------+
3 rows in set (0.00 sec)
----------------------------------------------------------------------------------------------------------


UC5:- Ability to delete a person using person's name.

==========================================================================================================

mysql> delete from addressbook where FirstName = 'Supriya';
Query OK, 1 row affected (0.01 sec)

mysql> select * from addressbook;
+-----------+------------+-----------+--------+--------+------------+--------------------+
| FirstName | LastName   | Address   | City   | Zip    | PhoneNo    | Email              |
+-----------+------------+-----------+--------+--------+------------+--------------------+
| Shivani   | Nandeshwar | Nandanwan | Nagpur | 441212 | 9443545678 | shvani08@gmail.com |
| Mansi     | Mannurwar  | Hingewadi | Pune   | 441208 | 7856413897 | mansi04@gmail.com  |
+-----------+------------+-----------+--------+--------+------------+--------------------+
2 rows in set (0.00 sec)

----------------------------------------------------------------------------------------------------
UC6 :- Ability to Retrieve Person belonging to a City or State from the Address Book

======================================================================================================

mysql> select * from addressbook where city = 'Nagpur' and state = 'Maharashtra';
+-----------+------------+-----------+--------+--------+------------+--------------------+-------------+
| FirstName | LastName   | Address   | City   | Zip    | PhoneNo    | Email              | state       |
+-----------+------------+-----------+--------+--------+------------+--------------------+-------------+
| Shivani   | Nandeshwar | Nandanwan | Nagpur | 441212 | 9443545678 | shvani08@gmail.com | Maharashtra |
+-----------+------------+-----------+--------+--------+------------+--------------------+-------------+
1 row in set (0.00 sec)

----------------------------------------------------------------------------------------------------------

UC7 :- Ability to understand the size of address book by City and State
      Here size indicates the count

========================================================================================================

mysql> select * from addressbook;
+-----------+------------+-----------+--------+--------+------------+--------------------+-------------+
| FirstName | LastName   | Address   | City   | Zip    | PhoneNo    | Email              | state       |
+-----------+------------+-----------+--------+--------+------------+--------------------+-------------+
| Shivani   | Nandeshwar | Nandanwan | Nagpur | 441212 | 9443545678 | shvani08@gmail.com | Maharashtra |
| Mansi     | Mannurwar  | Hingewadi | Pune   | 441208 | 7856413897 | mansi04@gmail.com  | Maharashtra |
| Supriya   | Bhurle     | Nandanwan | Nagpur | 441212 | 9442181947 | supriya@gmail.com  | Maharashtra |
+-----------+------------+-----------+--------+--------+------------+--------------------+-------------+
3 rows in set (0.00 sec)

mysql> select count(City), count(State) from addressbook;
+-------------+--------------+
| count(City) | count(State) |
+-------------+--------------+
|           3 |            3 |
+-------------+--------------+
1 row in set (0.00 sec)

mysql> select count(FirstName) from addressbook;
+------------------+
| count(FirstName) |
+------------------+
|                3 |
+------------------+
1 row in set (0.00 sec)

mysql>  select count(*) from addressbook where State = 'Maharashtra';
+----------+
| count(*) |
+----------+
|        3 |
+----------+
1 row in set (0.00 sec)

mysql>  select count(*) from addressbook where City = 'Nagpur';
+----------+
| count(*) |
+----------+
|        2 |
+----------+
1 row in set (0.00 sec)

---------------------------------------------------------------------------------------------------------
UC8 :- Ability to retrieve entries sorted alphabetically by Person’s name for a given city.

=========================================================================================================

mysql> select * from addressbook where City = 'Nagpur' order by FirstName ASC;
+-----------+------------+-----------+--------+--------+------------+--------------------+-------------+
| FirstName | LastName   | Address   | City   | Zip    | PhoneNo    | Email              | state       |
+-----------+------------+-----------+--------+--------+------------+--------------------+-------------+
| Shivani   | Nandeshwar | Nandanwan | Nagpur | 441212 | 9443545678 | shvani08@gmail.com | Maharashtra |
| Supriya   | Bhurle     | Nandanwan | Nagpur | 441212 | 9442181947 | supriya@gmail.com  | Maharashtra |
+-----------+------------+-----------+--------+--------+------------+--------------------+-------------+
2 rows in set (0.00 sec)

---------------------------------------------------------------------------------------------------------

UC9 :- Ability to identify each Address Book with name and
Type.
=========================================================================================================

mysql> alter table addressbook add Name Varchar(20) after Email;
Query OK, 0 rows affected (0.02 sec)
Records: 0  Duplicates: 0  Warnings: 0

mysql> alter table addressbook add Type Varchar(20) after Name;
Query OK, 0 rows affected (0.01 sec)
Records: 0  Duplicates: 0  Warnings: 0

mysql> select * from addressbook;
+-----------+------------+-----------+--------+--------+------------+--------------------+------+------+-------------+
| FirstName | LastName   | Address   | City   | Zip    | PhoneNo    | Email              | Name | Type | state       |
+-----------+------------+-----------+--------+--------+------------+--------------------+------+------+-------------+
| Shivani   | Nandeshwar | Nandanwan | Nagpur | 441212 | 9443545678 | shvani08@gmail.com | NULL | NULL | Maharashtra |
| Mansi     | Mannurwar  | Hingewadi | Pune   | 441208 | 7856413897 | mansi04@gmail.com  | NULL | NULL | Maharashtra |
| Supriya   | Bhurle     | Nandanwan | Nagpur | 441212 | 9442181947 | supriya@gmail.com  | NULL | NULL | Maharashtra |
+-----------+------------+-----------+--------+--------+------------+--------------------+------+------+-------------+
3 rows in set (0.00 sec)

mysql> update addressbook set Name = 'ContactName' where FirstName = 'Mansi' or FirstName = 'shivani';
Query OK, 2 rows affected (0.00 sec)
Rows matched: 2  Changed: 2  Warnings: 0

mysql> select * from addressbook;
+-----------+------------+-----------+--------+--------+------------+--------------------+-------------+------+-------------+
| FirstName | LastName   | Address   | City   | Zip    | PhoneNo    | Email              | Name        | Type | state       |
+-----------+------------+-----------+--------+--------+------------+--------------------+-------------+------+-------------+
| Shivani   | Nandeshwar | Nandanwan | Nagpur | 441212 | 9443545678 | shvani08@gmail.com | ContactName | NULL | Maharashtra |
| Mansi     | Mannurwar  | Hingewadi | Pune   | 441208 | 7856413897 | mansi04@gmail.com  | ContactName | NULL | Maharashtra |
| Supriya   | Bhurle     | Nandanwan | Nagpur | 441212 | 9442181947 | supriya@gmail.com  | NULL        | NULL | Maharashtra |
+-----------+------------+-----------+--------+--------+------------+--------------------+-------------+------+-------------+
3 rows in set (0.00 sec)

mysql> update addressbook set Type = 'Friends' where FirstName = 'Supriya';
Query OK, 1 row affected (0.00 sec)
Rows matched: 1  Changed: 1  Warnings: 0

mysql> update addressbook set Type = 'Family' where FirstName = 'Shivani';
Query OK, 1 row affected (0.00 sec)
Rows matched: 1  Changed: 1  Warnings: 0

mysql> update addressbook set Type = 'profession' where FirstName = 'Mansi';
Query OK, 1 row affected (0.00 sec)
Rows matched: 1  Changed: 1  Warnings: 0

mysql> select * from addressbook;
+-----------+------------+-----------+--------+--------+------------+--------------------+-------------+------------+-------------+
| FirstName | LastName   | Address   | City   | Zip    | PhoneNo    | Email              | Name        | Type       | state       |
+-----------+------------+-----------+--------+--------+------------+--------------------+-------------+------------+-------------+
| Shivani   | Nandeshwar | Nandanwan | Nagpur | 441212 | 9443545678 | shvani08@gmail.com | ContactName | Family     | Maharashtra |
| Mansi     | Mannurwar  | Hingewadi | Pune   | 441208 | 7856413897 | mansi04@gmail.com  | ContactName | profession | Maharashtra |
| Supriya   | Bhurle     | Nandanwan | Nagpur | 441212 | 9442181947 | supriya@gmail.com  | NULL        | Friends    | Maharashtra |
+-----------+------------+-----------+--------+--------+------------+--------------------+-------------+------------+-------------+
3 rows in set (0.00 sec)

-----------------------------------------------------------------------------------------------------------------------------------------------------------

uc10 :- Ability to get number of contact persons
i.e. count by type
=============================================================================================================================================================

mysql> select * from addressbook;
+-----------+------------+-----------+--------+--------+------------+--------------------+-------------+------------+-------------+
| FirstName | LastName   | Address   | City   | Zip    | PhoneNo    | Email              | Name        | Type       | state       |
+-----------+------------+-----------+--------+--------+------------+--------------------+-------------+------------+-------------+
| Shivani   | Nandeshwar | Nandanwan | Nagpur | 441212 | 9443545678 | shvani08@gmail.com | ContactName | Family     | Maharashtra |
| Mansi     | Mannurwar  | Hingewadi | Pune   | 441208 | 7856413897 | mansi04@gmail.com  | ContactName | profession | Maharashtra |
| Supriya   | Bhurle     | Nandanwan | Nagpur | 441212 | 9442181947 | supriya@gmail.com  | NULL        | Friends    | Maharashtra |
+-----------+------------+-----------+--------+--------+------------+--------------------+-------------+------------+-------------+
3 rows in set (0.00 sec)

mysql> select count(*) from addressbook where Type = 'Family';
+----------+
| count(*) |
+----------+
|        1 |
+----------+
1 row in set (0.00 sec)

mysql> select count(*) from addressbook where Type = 'Friends';
+----------+
| count(*) |
+----------+
|        1 |
+----------+
1 row in set (0.00 sec)

mysql> select count(*) from addressbook where Type = 'Profession';
+----------+
| count(*) |
+----------+
|        1 |
+----------+
1 row in set (0.00 sec)

mysql>  select count(Type) from addressbook;
+-------------+
| count(Type) |
+-------------+
|           3 |
+-------------+
1 row in set (0.00 sec)
----------------------------------------------------------------------------------------------------------
UC10 :- Ability to add person to both Friend and
Family
==========================================================================================================
mysql> INSERT INTO addressbook (firstName, LastName, Address, city, zip, phoneNo, Email, state)values
    -> ('Surabhi','Kohapare','Jatpara gate','Chandrapur','441207','8668158325','surabhi@gmail.com','Maharashtra');
Query OK, 1 row affected (0.00 sec)

mysql> select * from addressbook;
+-----------+------------+--------------+------------+--------+------------+--------------------+-------------+------------+-------------+
| FirstName | LastName   | Address      | City       | Zip    | PhoneNo    | Email              | Name        | Type       | state       |
+-----------+------------+--------------+------------+--------+------------+--------------------+-------------+------------+-------------+
| Shivani   | Nandeshwar | Nandanwan    | Nagpur     | 441212 | 9443545678 | shvani08@gmail.com | ContactName | Family     | Maharashtra |
| Mansi     | Mannurwar  | Hingewadi    | Pune       | 441208 | 7856413897 | mansi04@gmail.com  | ContactName | profession | Maharashtra |
| Supriya   | Bhurle     | Nandanwan    | Nagpur     | 441212 | 9442181947 | supriya@gmail.com  | NULL        | Friends    | Maharashtra |
| Surabhi   | Kohapare   | Jatpara gate | Chandrapur | 441207 | 8668158325 | surabhi@gmail.com  | NULL        | NULL       | Maharashtra |
+-----------+------------+--------------+------------+--------+------------+--------------------+-------------+------------+-------------+
4 rows in set (0.00 sec)
---------------------------------------------------------------------------------------------------------------------------------------------------------------------
